{
  "schema_version": "v1",
  "request_id": "55555555-5555-4555-8555-555555555555",
  "tenant_id": "11111111-1111-4111-8111-111111111111",
  "pipeline_profile": "municipal_document_v1",
  "document_version_id": "aaaaaaaa-0000-4000-8000-000000000106",
  "artifact_sha256": "aaaaaaaaaaaaaaaaaaaaaaaaaaaaaaaaaaaaaaaaaaaaaaaaaaaaaaaaaaaaaaaa"
}
